{
  "schema_version": "2.4",
  "case_id": "CASE-V24-EXAMPLE",
  "sensor_result_digest": "e770b94f4649f892d008c247abfe91ebf7c8b705c7d44963a558a6c571ca4b03",
  "evaluation_sources": [
    "invariant",
    "L1",
    "L2"
  ],
  "scores": {
    "correctness": 1.0,
    "coverage": 1.0,
    "stability": 0.75,
    "performance": 1.0,
    "calibration": 0.9,
    "safety": 1.0
  },
  "overall_score": 0.9475,
  "failure_tags": [
    "DIFF-HEURISTIC"
  ],
  "reproduction": {
    "attempts": 3,
    "reproduced": 3
  },
  "family_occurrences": 3,
  "promotion": {
    "case_bank": false,
    "adversarial_required": false,
    "improvement_candidate": false,
    "reason": "harness-derived"
  },
  "derived_by": {
    "evaluator_version": "2.4.0",
    "policy_digest": "218cfb36212c7c7981be1f2adbb81b839d17cbab31a549a326fb5a5691431203"
  }
}
